{"authority":"CANONICAL_RECORD","current_position":"AJ-01 through AJ-12 are PROVEN; CAP-027 is RESTORED and ACTIVE; all 28 capability dispositions are reconciled; generated-current state is accepted through PR #220; the final whole-Quest Strikeforce is GREEN; and Phoenix recovery is PROVEN and ACCEPTED. The restart-safe Sunset is sealed while RP-C08 and Repairing Prime remain IN_PROGRESS only for final completion.","exact_source_references":[{"authority":"CANONICAL_SOURCE","digest":"sha256:1c2d99a8ac0786c7a1981301f2427dadb24d44081f0c7077fb46a9ac0fcd9f04","ref_id":"capability-acceptance-contract","uri":"governance/capability-acceptance-contract.md"},{"authority":"CANONICAL_SOURCE","digest":"sha256:646b76a12628e135b327cf020e70347bdf005f94feb503f4bdfa58315946af5c","ref_id":"prime-continuity-register","uri":"continuity/prime-continuity-register-r01.json"},{"authority":"CANONICAL_SOURCE","digest":"sha256:839368353c91749725fe956e7859e50f53dd2552fa77911c4abe329db67bacf6","ref_id":"lifecycle-contract","uri":"lifecycle/lifecycle-contract.md"},{"authority":"CANONICAL_SOURCE","digest":"sha256:9c94dff78c0d466528afa9737cee42b5ce4777ee0c7f21785d2d4c1a88aa0939","ref_id":"repairing-prime-source","uri":"quests/repairing-prime.md"},{"authority":"EVIDENCE_POINTER","digest":"sha256:ac88bb6a60ff1adb53996239e4f69a253f9c197cc2a9dc76540865410ca8d0f9","ref_id":"phoenix-recovery-acceptance","uri":"proof/repairing-prime/rp-c08-phoenix-recovery-acceptance-r01.md"}],"latest_feather_id":"FTR-FYRBRXR57VWRYOZFORNP67R3H4","next_gate":"FINAL_REPAIRING_PRIME_COMPLETION_TRANSACTION","protected_data":{"classification":"INTERNAL_CLEAN","clean_summary":"The final Repairing Prime Sunset contains only public-clean Atlas source references, sanitized evidence pointers, and no protected values.","protected_pointers":[]},"record_id":"SRI-A5U4QQHMN4IG64TC34DRV4A4QK","related_golden_wing_ids":[],"resolved_source_fingerprint":"sha256:8a466ed15f362668c55ff037768f2fe9f4f793772fc108f467f35404c59ad5f3","schema_id":"atlas.lifecycle.sunrise","schema_version":"1.0.0","stale_projection_warnings":["Generated lifecycle projection must be refreshed after the source transaction merges."],"sunset_id":"SUN-EQA3Q3YZ4VDDMPJWHLTFRRDN6Q","unresolved_blockers":["The final Repairing Prime completion transaction remains separately gated."]}
