{"authority":"CANONICAL_RECORD","current_position":"Prime Ascendant remains ACTIVE — ARCHITECTURE REFINEMENT at PA-C01-COVENANT-REFINEMENT under Operation Harmony. The admitted Quest remains in source architecture refinement; runtime is NOT STARTED; Gitea cutover, legacy route retirement, repository settings, READY, and MERGE are NOT AUTHORIZED. The chat closeout is bounded to one full Atlas Sunset source candidate and its exact-head draft-PR proof.","exact_source_references":[{"authority":"CANONICAL_SOURCE","digest":"sha256:0d884bd8bcedc9834b4e258fe507f9e45dead3d736d82293c796a3a8bddccacb","ref_id":"quest-board","uri":"quest-board/quest-board-v1.json"},{"authority":"CANONICAL_SOURCE","digest":"sha256:0f488fbc21c6d8cef3e79767f97bdda5bb164050f6f82a8527ce93a4337e8baf","ref_id":"prime-continuity-register","uri":"continuity/prime-continuity-register-r01.json"},{"authority":"CANONICAL_SOURCE","digest":"sha256:4d16665bc75097fdb2485d27070b2d93e6c856d40cd3052f068c1b10aff8a9f9","ref_id":"lifecycle-contract","uri":"lifecycle/lifecycle-contract.md"},{"authority":"CANONICAL_SOURCE","digest":"sha256:53aa536bbc5e1e8833b640dea318bbbee5e8e19cf97c17e5633b7d6bee038c91","ref_id":"lesson-harvest-protocol","uri":"governance/lesson-harvest-protocol.md"},{"authority":"CANONICAL_SOURCE","digest":"sha256:6cc3fedb2f33fa345d8b70d34f3b0251927c10d5c23a230e5bef56b655f0ee60","ref_id":"prime-integrity-validation-doctrine","uri":"tools/prime_checks/targeted_validation.py"},{"authority":"CANONICAL_SOURCE","digest":"sha256:878edadea46c67ce70cf5a6e4402b791010154ea4e219131a40c0bc211a6fea4","ref_id":"prime-ascendant-covenant","uri":"quests/prime-ascendant-covenant.md"},{"authority":"CANONICAL_SOURCE","digest":"sha256:b62714f7389c125e69487248c5636cc8cf2211a8999fc0f05c993197a24f00cd","ref_id":"assurance-controls","uri":"governance/assurance-controls.json"},{"authority":"CANONICAL_SOURCE","digest":"sha256:cb532b4216333614773847a445f08e8b6e144c6362767d42fe06b805a09b1b51","ref_id":"lifecycle-construction-contract","uri":"lifecycle/lifecycle-construction-contract.md"},{"authority":"CANONICAL_SOURCE","digest":"sha256:cc99c59d155f5fb09057b9ecdfd81b203919fee417c95985b6b15c5ad60088d2","ref_id":"prime-ascendant-quest","uri":"quests/prime-ascendant.md"},{"authority":"EVIDENCE_POINTER","digest":"sha256:52e6b5037a17181737873aa03205e0e9a562651a7db6f364537ae8fa0e0a9b22","ref_id":"prime-ascendant-continuity-reconciliation","uri":"tests/prime-program/test_prime_ascendant_covenant.py"},{"authority":"EVIDENCE_POINTER","digest":"sha256:6cc3fedb2f33fa345d8b70d34f3b0251927c10d5c23a230e5bef56b655f0ee60","ref_id":"merged-pr-246-deterministic-generated-refresh","uri":"tools/prime_checks/targeted_validation.py"},{"authority":"EVIDENCE_POINTER","digest":"sha256:6cc3fedb2f33fa345d8b70d34f3b0251927c10d5c23a230e5bef56b655f0ee60","ref_id":"merged-pr-247-prime-integrity-gitea-phoenix-augmentation","uri":"tests/prime-program/test_targeted_validation.py"},{"authority":"EVIDENCE_POINTER","digest":"sha256:cc99c59d155f5fb09057b9ecdfd81b203919fee417c95985b6b15c5ad60088d2","ref_id":"merged-pr-245-naming-architecture-refraction","uri":"quests/prime-ascendant.md"}],"latest_feather_id":"FTR-DI2NRWYNLEBRSNY7TX6F4YIFMY","next_gate":"PA-C01-COVENANT-REFINEMENT","protected_data":{"classification":"INTERNAL_CLEAN","clean_summary":"Only sanitized doctrine, public repository identities, merged-PR evidence references, lifecycle state, unresolved work, and restart guidance are included. No credentials, tokens, keys, MFA or recovery codes, private network values, PHI, raw finance or account evidence, private exports, or unredacted logs are stored.","protected_pointers":[]},"record_id":"SRI-ZYQIUOYT5I64OCK3QO2C7RATO3","related_golden_wing_ids":[],"resolved_source_fingerprint":"sha256:85374d0649abd657c920ea48847883f3aeb7430c6b746857acb4c3dcd665b03d","schema_id":"atlas.lifecycle.sunrise","schema_version":"1.0.0","stale_projection_warnings":["Generated lifecycle projection must be refreshed after the source transaction merges."],"sunset_id":"SUN-F2U7ESSCGSIUAG3HNQQXWDDV4V","unresolved_blockers":["PA-C01 Covenant acceptance and the architecture decisions listed in the Covenant remain unresolved by design.","The Windows-not-required observation is not established until unchanged exact-head hosted readback proves the requested conclusions.","Both Windows-required and Windows-skipped observations must be independently verified before a separately authorized repository ruleset migration.","Generated projections remain intentionally stale until the separate generated-only refresh transaction after a separately authorized merge.","No runtime, infrastructure, database, webhook, Gitea, cutover, route-retirement, settings, ruleset, or protected-data authority is granted."]}
