{"authority":"CANONICAL_RECORD","current_position":"The final authored lifecycle records close this chat while preserving Prime Ascendant at PA-C01 covenant refinement. Durable source is merged through Transaction 3, generated projections await Transaction 5, and every runtime or infrastructure boundary remains closed.","exact_source_references":[{"authority":"CANONICAL_SOURCE","digest":"sha256:1828c32ca24fec3e4d61225e4e22d7b15c81454968526b729259687dd3557000","ref_id":"prime-continuity-register","uri":"continuity/prime-continuity-register-r01.json"},{"authority":"CANONICAL_SOURCE","digest":"sha256:289bcbef6553802307f1a68e895aeb3b64b80c9e40db4bf717252a454c6aab39","ref_id":"campaign-stage-receipt-schema","uri":"schemas/shardblade-campaign-stage-receipt-v1.schema.json"},{"authority":"CANONICAL_SOURCE","digest":"sha256:4a60520db7b26d1608b55a67cffbd9286765eca8ea8a5644870e92e55be8d516","ref_id":"campaign-warrant-schema","uri":"schemas/shardblade-campaign-warrant-v1.schema.json"},{"authority":"CANONICAL_SOURCE","digest":"sha256:53aa536bbc5e1e8833b640dea318bbbee5e8e19cf97c17e5633b7d6bee038c91","ref_id":"lesson-harvest-protocol","uri":"governance/lesson-harvest-protocol.md"},{"authority":"CANONICAL_SOURCE","digest":"sha256:54f9d8e6ef9235282829fcd0f91656f467c8b66300cc06659c3458efc2597ca4","ref_id":"prime-ascendant-quest","uri":"quests/prime-ascendant.md"},{"authority":"CANONICAL_SOURCE","digest":"sha256:8e3aa1ce6c597a83cdd25d7abdffbfb375442371fb72c284b08a5328d08150b5","ref_id":"campaign-stage-request-schema","uri":"schemas/shardblade-campaign-stage-request-v1.schema.json"},{"authority":"CANONICAL_SOURCE","digest":"sha256:d795a000af1aee89b1681236c2019fd67497ce03df90f3b095732f6b4a9f4700","ref_id":"quest-board","uri":"quest-board/quest-board-v1.json"},{"authority":"CANONICAL_SOURCE","digest":"sha256:f413e486cdcf0b0044845ed9ada5ef4a32a24c8be7199679ca6c2ebcd1202f3f","ref_id":"prime-ascendant-covenant","uri":"quests/prime-ascendant-covenant.md"},{"authority":"EVIDENCE_POINTER","digest":"sha256:1c90c27cc6600251e3bb3cfe00b58a36d7c7cd910bb3e68b2e4c6435ffb9c573","ref_id":"campaign-control-tests","uri":"tests/prime-program/test_shardblade_campaign.py"},{"authority":"EVIDENCE_POINTER","digest":"sha256:c3dfe90181f3a79a00b43cf793b6c2c6070dca8c22839d909f98097c36997ed0","ref_id":"ascendant-reconciliation-tests","uri":"tests/prime-program/test_prime_ascendant_covenant.py"}],"latest_feather_id":"FTR-SCFUZB37GJBLW4SL2JSH32LQBP","next_gate":"PA-C01-COVENANT-REFINEMENT","protected_data":{"classification":"INTERNAL_CLEAN","clean_summary":"Only sanitized doctrine, public repository identities, exact public Git evidence, and clean evidence pointers are included. No credentials, private network values, PHI, raw finance data, unrestricted logs, or protected payloads are present.","protected_pointers":[]},"record_id":"SRI-KCWAW7UQL3VKLKHKLBNSEOD6TF","related_golden_wing_ids":[],"resolved_source_fingerprint":"sha256:98f9585a77c5d3718fd581ced0662c15167269cf0583522a888e4a48682a88d6","schema_id":"atlas.lifecycle.sunrise","schema_version":"1.0.0","stale_projection_warnings":["Generated lifecycle projection must be refreshed after the source transaction merges."],"sunset_id":"SUN-RMB6SQVXEERPZ7Z557FBF4RWQV","unresolved_blockers":["Generated projections are intentionally stale until the separately gated Transaction 5.","PA-C01 covenant acceptance and architecture decisions remain unresolved; this lifecycle closeout does not advance the Quest gate.","No runtime, infrastructure, cutover, route-retirement, settings, or protected-data authority is granted."]}
