{"authority":"CANONICAL_RECORD","current_position":"Universal Sunset/Feather source repair is canonical. AJ-10 and CAP-022 live acceptance is executing while the preserved M06 and later RP-C08 gates remain open.","exact_source_references":[{"authority":"CANONICAL_SOURCE","digest":"sha256:1c2d99a8ac0786c7a1981301f2427dadb24d44081f0c7077fb46a9ac0fcd9f04","ref_id":"capability-acceptance-contract","uri":"governance/capability-acceptance-contract.md"},{"authority":"CANONICAL_SOURCE","digest":"sha256:8cdc470ddb98b62bd3648d69441b6f8bf0ce000c79ea4e52ff0220ab2ddae737","ref_id":"lifecycle-contract","uri":"lifecycle/lifecycle-contract.md"},{"authority":"CANONICAL_SOURCE","digest":"sha256:9c94dff78c0d466528afa9737cee42b5ce4777ee0c7f21785d2d4c1a88aa0939","ref_id":"repairing-prime-source","uri":"quests/repairing-prime.md"},{"authority":"EVIDENCE_POINTER","digest":"sha256:17ae65cdd5949e31bc50512f8e9f46c0aefd0a229e10bda1c34729f9bfd48f2c","ref_id":"sunset-feather-truth-reconciliation","uri":"proof/repairing-prime/rp-c08-sunset-feather-truth-reconciliation-r03.json"}],"latest_feather_id":"FTR-NSTEALUEMBITCO27XTBC2542XN","next_gate":"MERGE_THEN_FRESH_CONTEXT_AJ10_CAP022_READBACK","protected_data":{"classification":"INTERNAL_CLEAN","clean_summary":"The live candidate contains only public-clean Atlas source and no protected values.","protected_pointers":[]},"record_id":"SRI-DUBGAIQYLHFMMJBUPTSFBAMO4G","related_golden_wing_ids":[],"resolved_source_fingerprint":"sha256:2131ef56eed47c80bde8910aed25d01e46021c617e0ae2f2792d8c6540fbdc8e","schema_id":"atlas.lifecycle.sunrise","schema_version":"1.0.0","stale_projection_warnings":["Generated lifecycle projection must be refreshed after the source transaction merges."],"sunset_id":"SUN-DENN2FBSZHJDHVX722YYKRJLBZ","unresolved_blockers":["AJ-10 requires merge and fresh-context exact-pair reconstruction.","CAP-022 remains missing until AJ-10 receives accepted evidence.","AJ-03, AJ-11, AJ-12, and CAP-027 remain open."]}
