{"authority":"CANONICAL_RECORD","current_position":"The non-Quest no-fabrication arm of AJ-10 is represented by one exact temporary candidate set.","exact_source_references":[{"authority":"CANONICAL_SOURCE","digest":"sha256:1c2d99a8ac0786c7a1981301f2427dadb24d44081f0c7077fb46a9ac0fcd9f04","ref_id":"capability-acceptance-contract","uri":"governance/capability-acceptance-contract.md"},{"authority":"CANONICAL_SOURCE","digest":"sha256:8cdc470ddb98b62bd3648d69441b6f8bf0ce000c79ea4e52ff0220ab2ddae737","ref_id":"lifecycle-contract","uri":"lifecycle/lifecycle-contract.md"},{"authority":"EVIDENCE_POINTER","digest":"sha256:17ae65cdd5949e31bc50512f8e9f46c0aefd0a229e10bda1c34729f9bfd48f2c","ref_id":"sunset-feather-truth-reconciliation","uri":"proof/repairing-prime/rp-c08-sunset-feather-truth-reconciliation-r03.json"}],"latest_feather_id":"FTR-STG4XK7DBGSXCHEADRP74P6AEH","next_gate":"COMBINED_AJ10_CAP022_EXACT_HEAD_AUDIT","protected_data":{"classification":"INTERNAL_CLEAN","clean_summary":"The live candidate contains only public-clean Atlas source and no protected values.","protected_pointers":[]},"record_id":"SRI-SRAE7PBMSMXG7GJU5U7L3XALKQ","related_golden_wing_ids":[],"resolved_source_fingerprint":"sha256:2131ef56eed47c80bde8910aed25d01e46021c617e0ae2f2792d8c6540fbdc8e","schema_id":"atlas.lifecycle.sunrise","schema_version":"1.0.0","stale_projection_warnings":["Generated lifecycle projection must be refreshed after the source transaction merges."],"sunset_id":"SUN-HYG6I5FEJZXSNJJQDZSLHUZSSK","unresolved_blockers":["Canonical acceptance remains pending exact-head audit, merge, and readback."]}
