{"authority":"CANONICAL_RECORD","current_position":"Mission #339 is CLOSED and CANONICAL at d53070403a7cdd84d800cbf3519c3456f5e6f9bd. Mission #338 remains the sole active Sunset attempt. Mission #333 is closed not planned, PR #337 is closed unmerged, and Prime Ascendant remains IN_PROGRESS at PA-C01-COVENANT-REFINEMENT.","exact_source_references":[{"authority":"CANONICAL_SOURCE","ref_id":"lesson-harvest-protocol","uri":"governance/lesson-harvest-protocol.md"},{"authority":"CANONICAL_SOURCE","ref_id":"lifecycle-contract","uri":"lifecycle/lifecycle-contract.md"},{"authority":"CANONICAL_SOURCE","ref_id":"mission-control-contract","uri":"governance/mission-control-interaction-contract.md"},{"authority":"CANONICAL_SOURCE","ref_id":"mission-first-handoff","uri":"governance/mission-first-chat-handoff-contract.md"},{"authority":"CANONICAL_SOURCE","ref_id":"prime-ascendant-covenant","uri":"quests/prime-ascendant-covenant.md"},{"authority":"CANONICAL_SOURCE","ref_id":"prime-ascendant-quest","uri":"quests/prime-ascendant.md"},{"authority":"CANONICAL_SOURCE","ref_id":"prime-continuity-register","uri":"continuity/prime-continuity-register-r01.json"},{"authority":"CANONICAL_SOURCE","ref_id":"quest-registry","uri":"continuity/mission-board-quest-registry-r01.json"},{"authority":"CANONICAL_SOURCE","ref_id":"sunset-router-contract","uri":"governance/sunset-router-contract.md"},{"authority":"EVIDENCE_POINTER","ref_id":"mission-261","uri":"github/issues/261"},{"authority":"EVIDENCE_POINTER","ref_id":"mission-280","uri":"github/issues/280"},{"authority":"EVIDENCE_POINTER","ref_id":"mission-281","uri":"github/issues/281"},{"authority":"EVIDENCE_POINTER","ref_id":"mission-332","uri":"github/issues/332"},{"authority":"EVIDENCE_POINTER","ref_id":"mission-333","uri":"github/issues/333"},{"authority":"EVIDENCE_POINTER","ref_id":"mission-334","uri":"github/issues/334"},{"authority":"EVIDENCE_POINTER","ref_id":"mission-338","uri":"github/issues/338"},{"authority":"EVIDENCE_POINTER","ref_id":"mission-339","uri":"github/issues/339"},{"authority":"EVIDENCE_POINTER","ref_id":"mission-340","uri":"github/issues/340"},{"authority":"EVIDENCE_POINTER","ref_id":"pull-325","uri":"github/pulls/325"},{"authority":"EVIDENCE_POINTER","ref_id":"pull-326","uri":"github/pulls/326"},{"authority":"EVIDENCE_POINTER","ref_id":"pull-327","uri":"github/pulls/327"},{"authority":"EVIDENCE_POINTER","ref_id":"pull-335","uri":"github/pulls/335"},{"authority":"EVIDENCE_POINTER","ref_id":"pull-336","uri":"github/pulls/336"},{"authority":"EVIDENCE_POINTER","ref_id":"pull-337","uri":"github/pulls/337"},{"authority":"EVIDENCE_POINTER","ref_id":"pull-341","uri":"github/pulls/341"}],"latest_feather_id":"FTR-DUXR2GP55SINPLJFGXMVTIU47D","next_gate":"After canonical readback reports SUNSET COMPLETE and closes Mission #338, close parent Mission #340 while preserving Prime Ascendant at PA-C01-COVENANT-REFINEMENT.","protected_data":{"classification":"INTERNAL_CLEAN","clean_summary":"Only public-clean repository, Mission, campaign, PR, lifecycle, decision, validation, blocker, dependency, rollback, and continuity identities are included.","protected_pointers":[]},"record_id":"SRI-DR735TRRCDOVQGFTYEC2C7CBML","related_golden_wing_ids":[],"resolved_source_fingerprint":"sha256:45a704eb4a7b8fff43ebb7982cacfb78de1c67533c3bedf9791380011a48f391","schema_id":"atlas.lifecycle.sunrise","schema_version":"1.0.0","stale_projection_warnings":["Generated lifecycle projection must be refreshed after the source transaction merges."],"sunset_id":"SUN-752SW3YJISOHSMCQBFBWHN7CPZ","unresolved_blockers":["PA-C01 Covenant acceptance and the architecture decisions listed in the Covenant remain unresolved by design.","Runtime, infrastructure, database, webhook, Gitea, cutover, route retirement, settings, ruleset, recovery, and protected-data authority remain unauthorized."]}
