{"authority":"CANONICAL_RECORD","current_position":"Ciel's Awakening and First Gluttony remain complete historical proof. Operation Ciel, Gluttony, and noncanonical Rimuru remain active capabilities; Ciel has no active Quest-registry or unfinished-continuity entry. Mission #332 closes this full Sunset through reviewed lifecycle publication and exact merged-main readback without runtime, protected action, Quest reactivation, or evidence promotion.","exact_source_references":[{"authority":"CANONICAL_SOURCE","ref_id":"ciels-awakening-quest-history","uri":"quests/ciels-awakening.md"},{"authority":"CANONICAL_SOURCE","ref_id":"lesson-harvest-protocol","uri":"governance/lesson-harvest-protocol.md"},{"authority":"CANONICAL_SOURCE","ref_id":"lifecycle-contract","uri":"lifecycle/lifecycle-contract.md"},{"authority":"CANONICAL_SOURCE","ref_id":"mission-first-chat-handoff","uri":"governance/mission-first-chat-handoff-contract.md"},{"authority":"CANONICAL_SOURCE","ref_id":"operation-ciel","uri":"operations/ciel.md"},{"authority":"CANONICAL_SOURCE","ref_id":"rimuru-registry","uri":"knowledge/rimuru/registry-r01.json"}],"latest_feather_id":"FTR-CI5JXXF4TLBKDP25GEY32QP3CD","next_gate":"Preserve Operation Ciel, Gluttony, and Rimuru as active capabilities while Ciel's completed Quest remains historical; route any later finding through a separately approved Mission.","protected_data":{"classification":"INTERNAL_CLEAN","clean_summary":"Only public-clean Atlas decisions, repository and Mission identities, source paths, hashes, validation results, sanitized lessons, recovery, and rollback are included. Secrets, credentials, PHI, raw financial, legal, tax, insurance, brokerage, account, private network, private runtime, raw export, personal archive, and unrestricted log values are excluded.","protected_pointers":[]},"record_id":"SRI-DPACUS2B4YVKZ2OT6Q4KQJE762","related_golden_wing_ids":[],"resolved_source_fingerprint":"sha256:19f3d1f49bee9198aa00ef9ce4069392922737cd4d8a52c46fdef9910a6ecf48","schema_id":"atlas.lifecycle.sunrise","schema_version":"1.0.0","stale_projection_warnings":["Generated lifecycle projection must be refreshed after the source transaction merges."],"sunset_id":"SUN-VNLF67ZMIDGSWNBYQLQLFLP2WO","unresolved_blockers":["The prepublication-validation NEW_CANDIDATE remains unadmitted and unpromoted.","Runtime, deployment, protected-data transfer, repository settings, Quest reactivation, infrastructure action, Golden Wing promotion, and assurance-control mutation remain unauthorized."]}
