{"authority":"CANONICAL_RECORD","current_position":"Canonical Arrow/Bow path classification parity and compiler-bound safe-declared handoff are merged through PRs 269 and 270 at main 6e48f5e3fba1e4a1bd826aa64602f616be5d5c89. The exact Mission 257 lifecycle carrier has compiled successfully through the repaired route. Prior Previews remain preserved as stale-base evidence; this final replacement Preview must stop for Jayson approval.","exact_source_references":[{"authority":"CANONICAL_SOURCE","ref_id":"lifecycle-contract","uri":"lifecycle/lifecycle-contract.md"},{"authority":"CANONICAL_SOURCE","ref_id":"mission-board-contract","uri":"governance/mission-board-contract.md"},{"authority":"CANONICAL_SOURCE","ref_id":"recovery-contract","uri":"recovery/elantris-recovery.md"},{"authority":"CANONICAL_SOURCE","ref_id":"sunset-router-contract","uri":"governance/sunset-router-contract.md"},{"authority":"EVIDENCE_POINTER","ref_id":"stage2-router-proof","uri":"proof/mission-257/stage-2-sunset-router-r01.json"},{"authority":"EVIDENCE_POINTER","ref_id":"stage3-ingress-proof","uri":"proof/mission-257/stage-3-execution-surface-r01.json"}],"latest_feather_id":"FTR-KG23DANMBMXCKERGICOJUVQHSB","next_gate":"MISSION_257_EXACT_LOCAL_PREVIEW_APPROVAL","protected_data":{"classification":"PUBLIC","clean_summary":"Only public Mission coordination, canonical repository references, and sanitized lifecycle acceptance evidence are included.","protected_pointers":[]},"record_id":"SRI-Y7HLDO4DPFROMGOMCMOH3EXOVO","related_golden_wing_ids":[],"resolved_source_fingerprint":"sha256:876cdd208f0fae87bf0628b9f4a8147ffcb5a717fa534be070b2497278d0cb07","schema_id":"atlas.lifecycle.sunrise","schema_version":"1.0.0","stale_projection_warnings":["Generated lifecycle projection must be refreshed after the source transaction merges."],"sunset_id":"SUN-HZPS7NW7FSTUYWQYHDBYFKXPQI","unresolved_blockers":["Exact Jayson approval of the generated Preview has not been recorded.","Lifecycle candidate publication and canonical byte readback have not started.","Generated projections remain stale pending the separate post-authored refresh."]}
