{"authority":"CANONICAL_RECORD","current_position":"Mission #319 is canonically closed as a non-Quest chat-closeout lifecycle record. Mission Control and Preview-first doctrine are already canonical; generated lifecycle projection freshness remains unproven.","exact_source_references":[{"authority":"CANONICAL_SOURCE","ref_id":"mission-control-contract","uri":"governance/mission-control-interaction-contract.md"},{"authority":"CANONICAL_SOURCE","ref_id":"ares-contract","uri":"governance/ares.md"},{"authority":"CANONICAL_SOURCE","ref_id":"strikeforce-contract","uri":"governance/atlas-strikeforce.md"},{"authority":"CANONICAL_SOURCE","ref_id":"glass-codex-client-contract","uri":"governance/glass-codex-client-contract.md"},{"authority":"CANONICAL_SOURCE","ref_id":"lifecycle-contract","uri":"lifecycle/lifecycle-contract.md"},{"authority":"EVIDENCE_POINTER","ref_id":"mission-317","uri":"github/issues/317"},{"authority":"EVIDENCE_POINTER","ref_id":"pull-318","uri":"github/pulls/318"},{"authority":"EVIDENCE_POINTER","ref_id":"mission-315","uri":"github/issues/315"},{"authority":"EVIDENCE_POINTER","ref_id":"pull-320","uri":"github/pulls/320"},{"authority":"EVIDENCE_POINTER","ref_id":"mission-316","uri":"github/issues/316"},{"authority":"EVIDENCE_POINTER","ref_id":"pull-321","uri":"github/pulls/321"},{"authority":"EVIDENCE_POINTER","ref_id":"mission-319","uri":"github/issues/319"}],"latest_feather_id":"FTR-FA7UPPVD7KEDTOEUYS3SKALQWP","next_gate":"SEPARATE_GENERATED_REFRESH_OR_NEW_MISSION","protected_data":{"classification":"PUBLIC","clean_summary":"Public-clean repository, Mission, lifecycle, validation, generated-state, and workflow context only; no protected values or runtime evidence are embedded.","protected_pointers":[]},"record_id":"SRI-VQAXVYUWZMYZKEAQCKQ47RCN3A","related_golden_wing_ids":[],"resolved_source_fingerprint":"sha256:ec05a7138cd3b1d2de857b78f5279185503ca80c140ea96bc876094d20c364c1","schema_id":"atlas.lifecycle.sunrise","schema_version":"1.0.0","stale_projection_warnings":["Generated lifecycle projection must be independently refreshed and verified after source lifecycle records merge."],"sunset_id":"SUN-4MJC2Q2VUTYYW2YCV4LUP6IRLG","unresolved_blockers":["Generated lifecycle projection freshness after PR #318 and later lifecycle merges remains unproven.","Any Glass Codex implementation, runtime activation, connector work, or protected operation requires separate authority."]}
