{"authority":"CANONICAL_RECORD","current_position":"Mission #316 is canonically closed as a non-Quest cross-Quest lifecycle record. The monitoring and architecture boundaries are restart-safe, while runtime and protected work remain explicit and unproven.","exact_source_references":[{"authority":"CANONICAL_SOURCE","ref_id":"mission-board-contract","uri":"governance/mission-board-contract.md"},{"authority":"CANONICAL_SOURCE","ref_id":"prime-ascendant-quest","uri":"quests/prime-ascendant.md"},{"authority":"CANONICAL_SOURCE","ref_id":"atlas-infrastructure-source","uri":"infrastructure/atlas-infrastructure-source.md"},{"authority":"CANONICAL_SOURCE","ref_id":"lifecycle-contract","uri":"lifecycle/lifecycle-contract.md"},{"authority":"EVIDENCE_POINTER","ref_id":"mission-313","uri":"github/issues/313"},{"authority":"EVIDENCE_POINTER","ref_id":"pull-314","uri":"github/pulls/314"},{"authority":"EVIDENCE_POINTER","ref_id":"mission-315","uri":"github/issues/315"},{"authority":"EVIDENCE_POINTER","ref_id":"pull-320","uri":"github/pulls/320"},{"authority":"EVIDENCE_POINTER","ref_id":"mission-316","uri":"github/issues/316"}],"latest_feather_id":"FTR-YYT5EL7BHQAEHNSMIYEPDMTCDZ","next_gate":"SEPARATE_AUTHORITY_REQUIRED","protected_data":{"classification":"PUBLIC","clean_summary":"Public-clean repository, Mission, lifecycle, architecture, monitoring, and workflow context only; no protected values or runtime evidence are embedded.","protected_pointers":[]},"record_id":"SRI-USPOOF4N4QXZVBAJ7PERMQSI3R","related_golden_wing_ids":[],"resolved_source_fingerprint":"sha256:a26c9135a05d08c5b57f1fd87f2700796b26c0874a0e1fe2a27f3f3564edd84d","schema_id":"atlas.lifecycle.sunrise","schema_version":"1.0.0","stale_projection_warnings":["Generated lifecycle projection must be refreshed after the source transaction merges."],"sunset_id":"SUN-77S5V4YRES3P2O3BOPO4TRA4AV","unresolved_blockers":["Notum installation, Linux configuration, UPS connection, telemetry, alert delivery, monitoring activation, and runtime recovery remain unproven and separately authorized.","Prometheus and Grafana deployment or reconfiguration remains outside this Sunset.","Gitea cutover, protected-data import, and Quest or Campaign advancement remain unproven."]}
